{
  "schema_id": "asklegal.hk-regulatory.state-decision-report",
  "schema_version": "1.0.0",
  "rule_id": "HKREG-STATE-DECISION-001",
  "case_id": "HKREG-DEC-STA-020",
  "assertion_scope": "ATOMIC_STATE",
  "observed_decision": {
    "schema_id": "asklegal.hk-regulatory.state-decision-result",
    "schema_version": "1.0.0",
    "rule_id": "HKREG-STATE-DECISION-001",
    "case_id": "HKREG-DEC-STA-020",
    "outcome": "QUARANTINE",
    "reason": "ATOMIC_STATE_DECIDED",
    "not_applicable": false,
    "branch_decisions": [
      {
        "branch_id": "branch-020",
        "state": "UNKNOWN",
        "disposition": "QUARANTINE",
        "processing_outcome": "QUARANTINE",
        "reason": "CURRENT_PRODUCT_CONFLICT",
        "applicability_context": null
      }
    ],
    "component_state": null,
    "record_responsibility": "NONE",
    "ordered_branch_ids": [],
    "source_failure_choice": "NONE",
    "carry_forward_support": null,
    "rebuild_target_authorized": false,
    "repair_rejected": false,
    "search_record_authorized": false,
    "embedding_authorized": false,
    "release_authorized": false,
    "serving_authorized": false,
    "external_effects": "NONE"
  },
  "expected_decision": {
    "schema_id": "asklegal.hk-regulatory.state-decision-result",
    "schema_version": "1.0.0",
    "rule_id": "HKREG-STATE-DECISION-001",
    "case_id": "HKREG-DEC-STA-020",
    "outcome": "QUARANTINE",
    "reason": "ATOMIC_STATE_DECIDED",
    "not_applicable": false,
    "branch_decisions": [
      {
        "branch_id": "branch-020",
        "state": "UNKNOWN",
        "disposition": "QUARANTINE",
        "processing_outcome": "QUARANTINE",
        "reason": "CURRENT_PRODUCT_CONFLICT",
        "applicability_context": null
      }
    ],
    "component_state": null,
    "record_responsibility": "NONE",
    "ordered_branch_ids": [],
    "source_failure_choice": "NONE",
    "carry_forward_support": null,
    "rebuild_target_authorized": false,
    "repair_rejected": false,
    "search_record_authorized": false,
    "embedding_authorized": false,
    "release_authorized": false,
    "serving_authorized": false,
    "external_effects": "NONE"
  },
  "conformance_status": "PASS",
  "source_authorized": false,
  "provider_authorized": false,
  "release_authorized": false,
  "serving_authorized": false,
  "deployment_authorized": false,
  "external_effects": "NONE"
}
